{"assetPackId":"p1_minh_kiem_walk","assetPackVersion":"v0.1.0","assets":[{"animations":[{"fps":8,"framesPerDirection":6,"loop":true,"name":"walk"}],"assetId":"CHR_MINH_KIEM_WALK","directions":["N","NE","E","SE","S","SW","W","NW"],"kind":"sprite_sheet","path":"Client/Assets/Art/Characters/MinhKiem/minh_kiem_walk.png","pivot":"bottom_center","pixelHeight":512,"pixelWidth":288,"pixelsPerUnit":20,"previewPath":"Client/Assets/Art/Previews/minh_kiem_walk_preview_x4.png","status":"draft"}],"owner":"Muse","sourceLicense":"original"}